Course Name,Course URL,Course short desc,Course long desc,Duration,Number of Enrolled,Cost,rating
Advanced Java Certification Training,https://www.edureka.co/advanced-java-sp?qId=36c4c21a16e3292f164506f3a520a29e&index_name=prod_search_results_courses&objId=193&objPos=18,"Includes Exceptions, Log4j, collections, network programming and many more",, 33 Hrs ,,,
Post Graduate Certificate in Human Resource Management,https://www.edureka.co/human-resourse-management-course-iim-shillong?qId=a03951d29291be230876a368ca9d97f3&index_name=prod_search_results_courses&objId=1909&objPos=1,Earn a certificate from IIM Shillong & SHRM India,, 140 Hrs ,,,
Advanced Executive Certificate in Product Management,https://www.edureka.co/advanced-executive-program-in-product-management-iitg?qId=a03951d29291be230876a368ca9d97f3&index_name=prod_search_results_courses&objId=1884&objPos=2,"Includes Product Conceptualization, Planning. Development and more",, 2 Hrs ,,,
Post Graduate Certificate Program in Data Science,https://www.edureka.co/data-science-program?qId=a03951d29291be230876a368ca9d97f3&index_name=prod_search_results_courses&objId=1396&objPos=12,"Includes Supervised Machine Learning, Deep Learning, and more",, 150 Hrs ,,,
MapReduce Design Patterns Certification Training,https://www.edureka.co/mapreduce-design-patterns-sp?qId=a03951d29291be230876a368ca9d97f3&index_name=prod_search_results_courses&objId=182&objPos=3,"Includes: filtering & join patterns, meta & graph patterns, & more",, 21 Hrs ,,,
Jenkins Certification Training Course,https://www.edureka.co/jenkins-certification-course?qId=a03951d29291be230876a368ca9d97f3&index_name=prod_search_results_courses&objId=1673&objPos=4,"Includes Jenkins Job, Managing jenkins, Jenkins pipeline and many more",, 21 Hrs ,,,
Ansible Certification Training Course ,https://www.edureka.co/ansible-certification-training?qId=a03951d29291be230876a368ca9d97f3&index_name=prod_search_results_courses&objId=1672&objPos=5,"Includes Ansible Playbooks, Modules, Roles, automation and many more",, 18 Hrs ,,,
Measuring Social Media ROI,https://www.edureka.co/measuring-social-media-roi-self-paced?qId=a03951d29291be230876a368ca9d97f3&index_name=prod_search_results_courses&objId=159&objPos=6,"Includes: Social media plan, ROI of Marketing and more",, 6 Hrs ,,,
jQuery Certification Training Course,https://www.edureka.co/jquery-training?qId=a03951d29291be230876a368ca9d97f3&index_name=prod_search_results_courses&objId=1521&objPos=7,"Includes DOM Manipulation, jQuery Forms, AJAX, Plugins, jQuery UI and more",, 24 Hrs ,,,
CSS Certification Training Course,https://www.edureka.co/css-certification-course?qId=a03951d29291be230876a368ca9d97f3&index_name=prod_search_results_courses&objId=1519&objPos=8,"Includes HTML elements like headings, paragraphs, images, links, etc.",, 18 Hrs ,,,
 HTML Certification Training Course,https://www.edureka.co/html-certification-course?qId=a03951d29291be230876a368ca9d97f3&index_name=prod_search_results_courses&objId=1518&objPos=9,"Includes HTML elements like headings, paragraphs, images, links, etc.",, 18 Hrs ,,,
QlikView Certification Training,https://www.edureka.co/qlikview-certification-training?qId=a03951d29291be230876a368ca9d97f3&index_name=prod_search_results_courses&objId=1419&objPos=10,"Includes: Scripting, Data Model, Transformation, Charts, Functions & more",, 21 Hrs ,,,
OpenStack Certification Training,https://www.edureka.co/open-stack?qId=a03951d29291be230876a368ca9d97f3&index_name=prod_search_results_courses&objId=1406&objPos=11,Prepare for OpenStack Administrator Exam by mastering Swift & many more,, 30 Hrs ,,,
Graphical Models Certification Training,https://www.edureka.co/graphical-modelling-course?qId=a03951d29291be230876a368ca9d97f3&index_name=prod_search_results_courses&objId=1389&objPos=13,"Includes HMM Models, Markov Chain, Bayesian Network, and more",, 18 Hrs ,,,
Reinforcement Learning,https://www.edureka.co/reinforcement-learning-course?qId=a03951d29291be230876a368ca9d97f3&index_name=prod_search_results_courses&objId=1388&objPos=14,"Includes Open AI Gym, Banit Algorithm, Dynamic Programming, Deep Q Learning",, 18 Hrs ,,,
Six Sigma Green Belt Certification Training,https://www.edureka.co/six-sigma-green-belt-self-paced?qId=a03951d29291be230876a368ca9d97f3&index_name=prod_search_results_courses&objId=138&objPos=15,"Includes: Fishbone/Ishikawa diagram, RCA, Corelation & Statistical Analysis",, 15 Hrs ,,,
Design Patterns Certification Training,https://www.edureka.co/design-patterns-self-paced?qId=a03951d29291be230876a368ca9d97f3&index_name=prod_search_results_courses&objId=137&objPos=16,"Includes: Creational, Structural & Behavioral Design Patterns & more",, 27 Hrs ,,,
Comprehensive HBase Certification Training,https://www.edureka.co/comprehensive-hbase?qId=a03951d29291be230876a368ca9d97f3&index_name=prod_search_results_courses&objId=127&objPos=17,"Includes: HBase Components & Architecture, Data Models, Operations & more",, 9 Hrs ,,,
Comprehensive Hive Certification Training,https://www.edureka.co/comprehensive-hive?qId=a03951d29291be230876a368ca9d97f3&index_name=prod_search_results_courses&objId=126&objPos=18,"Includes: Hive Architecture, partitions & buckets, Thrift Servers & more",, 9 Hrs ,,,
PG Certification Program in Marketing with Specialization in Digital Marketing,https://www.edureka.co/digital-marketing-certification?qId=3288bb6239088afdcb51bdb3ef039813&index_name=prod_search_results_courses&objId=1173&objPos=2,"Includes: Industry grade Projects, Social Media Marketing, SEO & more",,Weekend/Weekday Classes,,,
Advanced Certification in Cloud Computing,https://www.edureka.co/advanced-cloud-computing-program?qId=3288bb6239088afdcb51bdb3ef039813&index_name=prod_search_results_courses&objId=1104&objPos=3,"Includes Architect & Manage Cloud Solutions, DevOps on Cloud and more",,Weekend/Weekday Classes,,,
Comprehensive Pig Certification Training,https://www.edureka.co/comprehensive-pig-self-paced?qId=3288bb6239088afdcb51bdb3ef039813&index_name=prod_search_results_courses&objId=124&objPos=1,"Includes: Pig Components, Data Models, Operators, UDFs and more",, 6 Hrs ,,,
