course_link,Title,Instructor,duration,level,rating
https://www.pluralsight.com/courses/sql-2012-database-administration-pt3,SQL Server 2012 Database Administration (70-462) Part 3,by Sean McCown,4h 51m,Intermediate,-341
https://www.pluralsight.com/courses/sql-server-compliance-and-auditing,"Practical SQL Server Security, Compliance, and Auditing",by Russ Thomas,3h 40m,Intermediate,-38
https://www.pluralsight.com/courses/microsoft-azure-administrator-automate-deployment-configuration-vm,Microsoft Azure Administrator: Automate Deployment and Configuration of Virtual Machines,by Michael Teske,34m,Beginner,-41
https://www.pluralsight.com/courses/microsoft-azure-solutions-architect-design-application-architecture,Microsoft Azure Solutions Architect: Design an Application Architecture,by Reza Salehi,1h 51m,Advanced,-28
https://www.pluralsight.com/courses/microsoft-azure-administrator-create-configure-containers,Microsoft Azure Administrator: Create and Configure Containers,by Michael Teske,38m,Beginner,-37
https://www.pluralsight.com/courses/android-tools-testing,Working with Android Tools and Testing,by Jim Wilson,2h 50m,Beginner,-146
https://www.pluralsight.com/courses/introduction-cisco-certified-devnet-professional-certification,Introduction to the Cisco Certified DevNet Professional Certification,by Nick Russo,17m,Intermediate,-22
https://www.pluralsight.com/courses/agile-fundamentals,Agile Fundamentals,by Stephen Haunts,2h 39m,Intermediate,-2276
https://www.pluralsight.com/courses/vlan-operation-configuration,VLAN Operation and Configuration,by Ross Bagurdes,2h 21m,Intermediate,-49
https://www.pluralsight.com/courses/cisco-enterprise-networks-implementing-ospf,Cisco Enterprise Networks: Implementing OSPF,by Ben Piper,2h 16m,Intermediate,-67
https://www.pluralsight.com/courses/linux-networking-advanced-lfce,LFCE: Advanced Linux Networking,by Anthony Nocentino,2h 45m,Intermediate,-77
https://www.pluralsight.com/courses/install-configure-adds-windows-server-2016,Install and Configure Active Directory Domain Services in Windows Server 2016,by Greg Shields,3h 19m,Intermediate,-113
https://www.pluralsight.com/courses/kubernetes-installation-configuration-fundamentals,Kubernetes Installation and Configuration Fundamentals,by Anthony Nocentino,3h 4m,Intermediate,-446
https://www.pluralsight.com/courses/managing-kubernetes-controllers-deployments,Managing Kubernetes Controllers and Deployments,by Anthony Nocentino,2h 48m,Intermediate,-98
https://www.pluralsight.com/courses/sql-2012-database-administration-pt2,SQL Server 2012 Database Administration (70-462) Part 2,by Sean McCown,5h 1m,Intermediate,-318
https://www.pluralsight.com/courses/automating-cisco-sd-wan-operations-using-apis,Automating Cisco SD-WAN Operations Using APIs,by Nick Russo,1h 33m,Intermediate,-17
https://www.pluralsight.com/courses/automating-cisco-dna-center-operations-using-apis,Automating Cisco DNA Center Operations Using APIs,by Nick Russo,1h 24m,Intermediate,-14
https://www.pluralsight.com/courses/akkadotnet-signalr-stateful-reactive-concurrent-spas,Stateful Reactive Concurrent SPAs with SignalR and Akka.NET 1,by Jason Roberts,2h 35m,Intermediate,-116
https://www.pluralsight.com/courses/managed-instance-groups-building-scalable-compute-solutions,Building Scalable Compute Solutions with Managed Instance Groups,by Vitthal Srinivasan,2h 6m,Intermediate,-10
https://www.pluralsight.com/courses/constructing-ui-angular,Constructing a User Interface with Angular,by David Mann,4h 34m,Intermediate,-78
https://www.pluralsight.com/courses/managing-modern-software-dependency-ecosystem,Managing the Modern Software Dependency Ecosystem,by Troy Hunt,29m,Intermediate,-42
https://www.pluralsight.com/courses/windows-workflows-powershell,Windows Workflows with Windows PowerShell,by Thomas Lee,2h 31m,Intermediate,-28
